{
  "schemaVersion": 1,
  "id": "security",
  "name": "Security",
  "description": "Owns security, credential, sensitive-data, and security-evidence controls.",
  "owners": ["security-leadership"],
  "policyApprovers": ["security-governance"],
  "maintainers": ["security-engineering"],
  "contributionMode": {
    "artifacts": "restricted",
    "controls": "restricted",
    "knowledge": "reviewed",
    "capabilities": "restricted"
  }
}
