{
  "schemaVersion": 1,
  "id": "data-platform",
  "name": "Data Platform",
  "description": "Owns reusable knowledge and integration capability for enterprise data platforms.",
  "owners": ["data-platform-leadership"],
  "policyApprovers": ["data-governance"],
  "maintainers": ["data-platform-engineering"],
  "contributionMode": {
    "artifacts": "reviewed",
    "controls": "restricted",
    "knowledge": "reviewed",
    "capabilities": "restricted"
  }
}
